{
  "schema_version": "1.0",
  "timestamp": 1735689600,
  "generated_at": "2025-01-01T00:00:00Z",
  "devices": {
    "Ethernet In": {
      "reachable": true,
      "rtt_ms": 8.1
    }
  },
  "events": [
    {"entity_id": "sensor.home_event", "state": "ok"}
  ],
  "context": {
    "daypart": "morning",
    "occupied": true
  }
}
